{
  "company": "NVIDIA Corporation",
  "ticker": "NVDA",
  "reporting_period": "2024",
  "currency": "USD",
  "schema": {
    "profile": "US_GAAP_SEC",
    "standard": "United States Generally Accepted Accounting Principles (US GAAP)",
    "presentation_standard": "FASB ASC Topic 230 and SEC reporting requirements",
    "statement_type": "cash_flow_statement",
    "statement_scope": "consolidated",
    "jurisdiction": "United States",
    "monetary_unit": "USD",
    "amount_scale": "1",
    "operating_cash_flow_method": "indirect",
    "presentation_basis": "not_applicable",
    "expense_analysis": "not_applicable"
  },
  "source": {
    "statement": "Consolidated statement of cash flows",
    "basis": "Audited consolidated figures; source presented in USD millions and normalized to full USD",
    "report": "NVIDIA Fiscal 2025 Form 10-K",
    "url": "https://www.sec.gov/Archives/edgar/data/1045810/000104581025000023/nvda-20250126.htm",
    "page": "Form 10-K p. 56, fiscal 2024 column",
    "taxonomy_element": "us-gaap:StatementOfCashFlowsIndirectMethod",
    "period_start": "2023-01-30",
    "period_end": "2024-01-28"
  },
  "operating_activities": [
    {
      "canonical_field": "cash_collected_from_customers",
      "name": "Cash collected from customers",
      "amount": "0",
      "source_field": "[not separately reported] Cash collected from customers",
      "description": "This indicator represents cash collected from customers. NVIDIA did not separately report this US_GAAP_SEC field for 2024; it is explicitly normalized to zero to keep the canonical field set complete.",
      "source_reference": "Form 10-K p. 56, fiscal 2024 column",
      "is_deduction": false,
      "is_subtotal": false,
      "cash_flow_direction": "not_applicable",
      "is_non_cash": false
    },
    {
      "canonical_field": "interest_and_dividends_received",
      "name": "Interest and dividends received",
      "amount": "0",
      "source_field": "[not separately reported] Interest and dividends received",
      "description": "This indicator represents interest and dividends received. NVIDIA did not separately report this US_GAAP_SEC field for 2024; it is explicitly normalized to zero to keep the canonical field set complete.",
      "source_reference": "Form 10-K p. 56, fiscal 2024 column",
      "is_deduction": false,
      "is_subtotal": false,
      "cash_flow_direction": "not_applicable",
      "is_non_cash": false
    },
    {
      "canonical_field": "other_operating_cash_receipts",
      "name": "Other operating cash receipts",
      "amount": "0",
      "source_field": "[not separately reported] Other operating cash receipts",
      "description": "This indicator represents other operating cash receipts. NVIDIA did not separately report this US_GAAP_SEC field for 2024; it is explicitly normalized to zero to keep the canonical field set complete.",
      "source_reference": "Form 10-K p. 56, fiscal 2024 column",
      "is_deduction": false,
      "is_subtotal": false,
      "cash_flow_direction": "not_applicable",
      "is_non_cash": false
    },
    {
      "canonical_field": "cash_paid_to_suppliers_and_employees",
      "name": "Cash paid to suppliers and employees",
      "amount": "0",
      "source_field": "[not separately reported] Cash paid to suppliers and employees",
      "description": "This indicator represents cash paid to suppliers and employees. NVIDIA did not separately report this US_GAAP_SEC field for 2024; it is explicitly normalized to zero to keep the canonical field set complete.",
      "source_reference": "Form 10-K p. 56, fiscal 2024 column",
      "is_deduction": false,
      "is_subtotal": false,
      "cash_flow_direction": "not_applicable",
      "is_non_cash": false
    },
    {
      "canonical_field": "interest_paid",
      "name": "Interest paid",
      "amount": "0",
      "source_field": "[not separately reported] Interest paid",
      "description": "This indicator represents interest paid. NVIDIA did not separately report this US_GAAP_SEC field for 2024; it is explicitly normalized to zero to keep the canonical field set complete.",
      "source_reference": "Form 10-K p. 56, fiscal 2024 column",
      "is_deduction": false,
      "is_subtotal": false,
      "cash_flow_direction": "not_applicable",
      "is_non_cash": false
    },
    {
      "canonical_field": "income_taxes_paid",
      "name": "Income taxes paid",
      "amount": "0",
      "source_field": "[not separately reported] Income taxes paid",
      "description": "This indicator represents income taxes paid. NVIDIA did not separately report this US_GAAP_SEC field for 2024; it is explicitly normalized to zero to keep the canonical field set complete.",
      "source_reference": "Form 10-K p. 56, fiscal 2024 column",
      "is_deduction": false,
      "is_subtotal": false,
      "cash_flow_direction": "not_applicable",
      "is_non_cash": false
    },
    {
      "canonical_field": "other_operating_cash_payments",
      "name": "Other operating cash payments",
      "amount": "0",
      "source_field": "[not separately reported] Other operating cash payments",
      "description": "This indicator represents other operating cash payments. NVIDIA did not separately report this US_GAAP_SEC field for 2024; it is explicitly normalized to zero to keep the canonical field set complete.",
      "source_reference": "Form 10-K p. 56, fiscal 2024 column",
      "is_deduction": false,
      "is_subtotal": false,
      "cash_flow_direction": "not_applicable",
      "is_non_cash": false
    },
    {
      "canonical_field": "net_income_starting_point",
      "name": "Net income starting point",
      "amount": "29760000000",
      "source_field": "Net income",
      "description": "This indicator represents net income starting point. NVIDIA filed 'Net income' at 29760 USD millions in NVIDIA Fiscal 2025 Form 10-K; it is mapped to US_GAAP_SEC field 'net_income_starting_point' and converted to full USD without adding precision.",
      "source_reference": "Form 10-K p. 56, fiscal 2024 column",
      "is_deduction": false,
      "is_subtotal": false,
      "cash_flow_direction": "net",
      "is_non_cash": false
    },
    {
      "canonical_field": "depreciation_depletion_and_amortisation",
      "name": "Depreciation and amortization",
      "amount": "1508000000",
      "source_field": "Depreciation and amortization",
      "description": "This indicator represents depreciation and amortization. NVIDIA filed 'Depreciation and amortization' at 1508 USD millions in NVIDIA Fiscal 2025 Form 10-K; it is mapped to US_GAAP_SEC field 'depreciation_depletion_and_amortisation' and converted to full USD without adding precision.",
      "source_reference": "Form 10-K p. 56, fiscal 2024 column",
      "is_deduction": false,
      "is_subtotal": false,
      "cash_flow_direction": "net",
      "is_non_cash": false
    },
    {
      "canonical_field": "deferred_income_taxes",
      "name": "Deferred income taxes",
      "amount": "-2489000000",
      "source_field": "Deferred income taxes",
      "description": "This indicator represents deferred income taxes. NVIDIA filed 'Deferred income taxes' at -2489 USD millions in NVIDIA Fiscal 2025 Form 10-K; it is mapped to US_GAAP_SEC field 'deferred_income_taxes' and converted to full USD without adding precision.",
      "source_reference": "Form 10-K p. 56, fiscal 2024 column",
      "is_deduction": false,
      "is_subtotal": false,
      "cash_flow_direction": "net",
      "is_non_cash": false
    },
    {
      "canonical_field": "share_based_compensation",
      "name": "Share-based compensation",
      "amount": "3549000000",
      "source_field": "Stock-based compensation expense",
      "description": "This indicator represents share-based compensation. NVIDIA filed 'Stock-based compensation expense' at 3549 USD millions in NVIDIA Fiscal 2025 Form 10-K; it is mapped to US_GAAP_SEC field 'share_based_compensation' and converted to full USD without adding precision.",
      "source_reference": "Form 10-K p. 56, fiscal 2024 column",
      "is_deduction": false,
      "is_subtotal": false,
      "cash_flow_direction": "net",
      "is_non_cash": false
    },
    {
      "canonical_field": "impairment_charges",
      "name": "Impairment charges",
      "amount": "0",
      "source_field": "[not separately reported] Impairment charges",
      "description": "This indicator represents impairment charges. NVIDIA did not separately report this US_GAAP_SEC field for 2024; it is explicitly normalized to zero to keep the canonical field set complete.",
      "source_reference": "Form 10-K p. 56, fiscal 2024 column",
      "is_deduction": false,
      "is_subtotal": false,
      "cash_flow_direction": "net",
      "is_non_cash": false
    },
    {
      "canonical_field": "gain_loss_on_disposals",
      "name": "Gain or loss on disposals",
      "amount": "0",
      "source_field": "[not separately reported] Gain or loss on disposals",
      "description": "This indicator represents gain or loss on disposals. NVIDIA did not separately report this US_GAAP_SEC field for 2024; it is explicitly normalized to zero to keep the canonical field set complete.",
      "source_reference": "Form 10-K p. 56, fiscal 2024 column",
      "is_deduction": false,
      "is_subtotal": false,
      "cash_flow_direction": "net",
      "is_non_cash": false
    },
    {
      "canonical_field": "equity_method_earnings",
      "name": "Equity-method earnings",
      "amount": "0",
      "source_field": "[not separately reported] Equity-method earnings",
      "description": "This indicator represents equity-method earnings. NVIDIA did not separately report this US_GAAP_SEC field for 2024; it is explicitly normalized to zero to keep the canonical field set complete.",
      "source_reference": "Form 10-K p. 56, fiscal 2024 column",
      "is_deduction": false,
      "is_subtotal": false,
      "cash_flow_direction": "net",